timestamp,employee_name,message
2025-10-29T20:18:04.119545,Spencer Allen,Great leadership on the Q4 project!
2025-10-29T20:18:04.119560,Dan Nelson Jr.,Excellent problem-solving during the outage.
2025-10-29T20:18:04.119685,Jamie Rivera,Your presentation was top-notch!
2025-10-29T20:18:04.119695,Priya Desai,Thanks for mentoring the new hires.
2025-10-29T20:18:04.119700,Marcus Lee,Your code reviews are always insightful.
2025-10-29T20:18:04.119706,Ava Thompson,Amazing job organizing the team event!
2025-10-29T20:18:04.119711,Liam Chen,Your documentation is incredibly helpful.
2025-10-29T20:18:04.119716,Noah Patel,Thanks for stepping up during crunch time.
2025-10-29T20:18:04.119721,Emma Brooks,Your creativity brought the campaign to life.
2025-10-29T20:18:04.119794,Olivia Nguyen,Fantastic collaboration with the design team.
